transcription_text,start,stop,path
อ่า คุณลูกค้าจ่ายขั้นต่ำไปก่อน เพราะว่าตอนนี้เรายังไม่ได้กดเงิน ใช่มั้ยคะ,58.47,62.65,\\192.168.1.70\Data1\Logger\ACU\AEON_COLLECTION\20170400_COLBKK_P1/2017-04-21/ch-142-40242001492758355-1320700.wav
ลูกค้าต้องเข้าใจด้วยนะครับ ว่าตอนเนี้ยเราให้คุณจ่ายขั้นต่ำ คุณก็ไม่สามารถที่จ่ายได้,131.05,136.55,\\192.168.1.70\Data1\Logger\ACU\AEON_COLLECTION\20170400_COLBKK_P1/2017-04-19/ch-71-20171001492584363-178313.wav
ถ้าลูกค้าไม่สะดวกนะคะ ดิฉันแนะนำจ่ายขั้นต่ำก่อนก็ได้ค่ะ หนึ่งงวด,37.46,41.85,\\192.168.1.70\Data1\Logger\ACU\AEON_COLLECTION\20170400_COLBKK_P1/2017-04-24/ch-22-40122001493021079-1543954.wav
ตัดระบบไม่ทัน แต่ว่ามันจ่ายเพิ่มเพราะว่าหน้าตู้มันจะจ่ายขั้นต่ำสองร้อยพอดีไง,44.66,48.98,\\192.168.1.70\Data1\Logger\ACU\AEON_COLLECTION\20170400_COLBKK_P1/2017-04-21/ch-41-40141001492743790-1154251.wav
จ้ะ เอ่อ คุณจ่ายขั้นต่ำ %(โหะ)% หกพัน ห้าร้อย หกสิบสามบาท คุณเบ็ดเสร็จแล้ว คุณจะกดคืนได้ห้าพัน มันก็ยังหมุนได้อยู่,137.93,144.91,\\192.168.1.70\Data1\Logger\ACU\AEON_COLLECTION\20170400_COLBKK_P1/2017-04-19/ch-150-20250001492573055-64219.wav
มันจะมีผลต่อการใช้บัตร มีผลต่อวงเงินแน่นอน จากเดิมตอนเนี้ย คุณจ่ายขั้นต่ำ,125.06,130.9,\\192.168.1.70\Data1\Logger\ACU\AEON_COLLECTION\20170400_COLBKK_P1/2017-04-19/ch-150-20250001492573055-64219.wav
ใช่ %?% ตามที่ทาง %เจ้าหน้าที่ <เจ้าที่>% เขาแจ้งเลย คุณจ่ายขั้นต่ำเข้ามา ยังไงคุณก็หมุนไปได้สองพัน,82.85,87.83,\\192.168.1.70\Data1\Logger\ACU\AEON_COLLECTION\20170400_COLBKK_P1/2017-04-19/ch-150-20250001492581754-150806.wav
แล้ว แล้วตัวรายการ ตัวอะไรนะ ตู้เย็น ตู้เย็นตรงนี้ คือยังไม่สะดวกใช่ไหม หนูจ่ายขั้นต่ำมาก่อน,84.55,91.1,\\192.168.1.70\Data1\Logger\ACU\AEON_COLLECTION\20170400_COLBKK_P1/2017-04-20/ch-84-20184001492676700-584306.wav
ไม่มีก็จ่ายขั้นต่ำของเดือนนั้นไป,700.05,702.4,\\192.168.1.70\Data1\Logger\ACU\AEON_COLLECTION\20170400_COLBKK_P1/2017-04-19/ch-182-20282001492586223-206941.wav
เจ็ดสอง เอ่อ ถ้า ถ้าคุณจะจ่ายเราจ่ายขั้นต่ำก่อนได้ คือเจ็ดสี่หนึ่ง เรา เราจ่ายเฉพาะขั้นต่ำก่อนได้เหมือนกัน,61.75,68.25,\\192.168.1.70\Data1\Logger\ACU\AEON_COLLECTION\20170400_COLBKK_P1/2017-04-20/ch-179-20279001492669227-499160.wav
อ๋อ เพราะว่าของคุณลูกค้าเองเนี่ย จ่าย ขั้นต่ำมันเจ็ดพัน เจ็ดพันจะกดได้แค่ห้าพัน เดี๋ยวขออนุญาตแนะนำแป๊บนึงนะคะ,49.35,56.62,\\192.168.1.70\Data1\Logger\ACU\AEON_COLLECTION\20170400_COLBKK_P1/2017-04-20/ch-150-20250001492666766-482913.wav
เอ่อ พี่จ่ายขั้นต่ำมาใช่มั้ย พี่ไม่ได้จ่ายห้าพันนะ,57.35,60.85,\\192.168.1.70\Data1\Logger\ACU\AEON_COLLECTION\20160200_COLHY_P1/2016-02-11/ch-82-10182001455157843-3590086.wav
แล้วจ่ายขั้นต่ำคือสามเปอร์เซ็นต์น่ะค่ะ สามเปอร์เซ็นต์อยู่ที่เก้าร้อยบาท,288.45,292.45,\\192.168.1.70\Data1\Logger\ACU\AEON_COLLECTION\20170400_COLBKK_P1/2017-04-24/ch-146-40246001493003229-1475281.wav
แต่ถ้าคุณลูกค้าจ่ายขั้นต่ำตลอดเนี่ย บริษัทก็จะกำหนดเอาไว้ว่าจะไม่เกินสี่สิบสองงวดลูกค้าจะหมดหนี้ก้อนนี้,207.08,213.47,\\192.168.1.70\Data1\Logger\ACU\AEON_COLLECTION\20170400_COLBKK_P1/2017-04-25/ch-151-40251001493107906-1801931.wav
ค่ะ ก็จะเรียกเก็บดอกเบี้ยนะคะ ถ้าอ่า ถ้าเกิดพี่จ่ายขั้นต่ำอีกรอบนึงนะคะ จะเป็นของวันที่สองเดือนหก มิถุนายน,193.63,201.21,\\192.168.1.70\Data1\Logger\ACU\AEON_COLLECTION\20170400_COLBKK_P1/2017-04-25/ch-13-20113001493102815-1194211.wav
ค่ะ จะรวมบิลจ่ายขั้นต่ำอยู่ที่ห้าพันหนึ่งร้อยกับสองบาทอ่ะค่ะ,41.9,45.2,\\192.168.1.70\Data1\Logger\ACU\AEON_COLLECTION\20170400_COLBKK_P1/2017-04-25/ch-191-40291001493099307-1707368.wav
ก็คือ ถ้า ถ้า ลูกค้าจ่ายขั้นต่ำหนึ่งงวดเนี่ย หนึ่งพันเก้าร้อย เก้าร้อยบาทเนี่ย บัตรลูกค้ากดได้หนึ่งพัน,641.65,648.95,\\192.168.1.70\Data1\Logger\ACU\AEON_COLLECTION\20170400_COLBKK_P1/2017-04-25/ch-180-60280001493100155-6438.wav
ก็คือเนี่ยวันนี้วันที่สอง ก็คือเข้าสามเดือนพอดีเลย เพราะว่าก่อนหน้านี้มียอดคงค้างอยู่ ก็จ่ายขั้นต่ำมาใช่มั้ยฮะ,229.56,235.05,\\192.168.1.70\Data1\Logger\ACU\AEON_COLLECTION\20170300_COLHY_P2/0302_17/73067_85519ee5e7545e9-10101001488448989-0.wav
ค่ะแต่ว่าเหมือนยอดการจ่ายขั้นต่ำของเดือนนี้อ่ะมันจะอยู่สามพันยี่สิบสี่บาทนะคะ ชำระขั้นต่ำก่อนก็ได้ค่ะ แล้วค่อยมาปิดนะคะ,187,195.21,\\192.168.1.70\Data1\Logger\ACU\AEON_COLLECTION\20170300_COLHY_P2/0302_12/73501_36ec8f03c4d153e-10101001488431601-0.wav
ยอดยอดที่จ่ายขั้นต่ำอ่ะครับ,77.5,79.6,\\192.168.1.70\Data1\Logger\ACU\AEON_COLLECTION\20170300_COLHY_P2/0304_08/73364_84768c9da7f23ac-10101001488591660-0.wav
เอ่อ เวลาเขาจ่ายเนี่ย เหมือนลูกค้าตรงนี้ ลูกค้าจ่ายขั้นต่ำแค่หนึ่งพันแปดร้อยแปดสิบ,610.88,615.86,\\192.168.1.70\Data1\Logger\ACU\AEON_COLLECTION\20170300_COLHY_P2/0302_10/73558_88c41d2876589ee-10101001488426532-0.wav
เอ่อ %?% วางบิลกับลูกค้า สามพันห้าร้อยห้าสิบห้า แต่ว่าเวลาลูกค้าจ่ายขั้นต่ำอ่ะค่ะ คือมันน้อยกว่านี้ไง,532.82,539.1,\\192.168.1.70\Data1\Logger\ACU\AEON_COLLECTION\20170300_COLHY_P2/0302_10/73558_88c41d2876589ee-10101001488426532-0.wav
แล้วลูกค้าจ่ายขั้นต่ำ สมมุติว่าตรงนี้เนี่ยยอดรวมมันทั้งหมดที่หมื่นกว่าแต่ว่าบริษัทให้ลูกค้าจ่ายแค่พันกว่าบาทตรงเนี้ยอ่ะคะ,362.82,369.67,\\192.168.1.70\Data1\Logger\ACU\AEON_COLLECTION\20170300_COLHY_P2/0302_10/73558_88c41d2876589ee-10101001488426532-0.wav
เพราะลูกค้าจ่ายขั้นต่ำปุ๊บ ตรงนี้เนี่ยเวลาประกันตัวอื่นมาใหม่เนี่ย มันก็จะสะสม เป็นยอดสะสมเรียกเก็บกันมาเรื่อยเรื่อยอ่ะค่ะ,355.26,362.83,\\192.168.1.70\Data1\Logger\ACU\AEON_COLLECTION\20170300_COLHY_P2/0302_10/73558_88c41d2876589ee-10101001488426532-0.wav
อ่า หนึ่งพัน ห้าร้อยเนี่ย จ่ายขั้นต่ำแต่ถ้าลูกค้าเนี่ย มีเยอะกว่านี้ ลูกค้าสามารถโปะเข้ามาได้เลย สามพัน สี่พัน สองพัน,326.66,334.34,\\192.168.1.70\Data1\Logger\ACU\AEON_COLLECTION\20170300_COLHY_P2/0303_17/73626_e5328848d914024-10101001488538362-0.wav
ทางบริษัทให้ลูกค้าจ่ายขั้นต่ำนะฮะ ขั้นต่ำแค่หนึ่งพัน ห้าร้อย ถูกต้องมั้ยคะ,322.65,326.5,\\192.168.1.70\Data1\Logger\ACU\AEON_COLLECTION\20170300_COLHY_P2/0303_17/73626_e5328848d914024-10101001488538362-0.wav
แล้วก็เดี๋ยวในส่วนของยอดขั้นต่ำเนี่ย ผมจะทำในส่วนของตรงนี้ให้ คือว่าให้จ่ายขั้นต่ำที่น้อยลง,64.27,69.39,\\192.168.1.70\Data1\Logger\ACU\AEON_COLLECTION\20170300_COLHY_P2/0302_14/73065_b1c684bd4141613-10101001488438331-0.wav
คือจะเข้าโครงการหรือว่าจะจ่ายขั้นต่ำครับตรงนี้,182.4,186.01,\\192.168.1.70\Data1\Logger\ACU\AEON_COLLECTION\20170300_COLHY_P2/0302_14/73065_b1c684bd4141613-10101001488438331-0.wav
ตรงนี้พอที่จะสนใจรึเปล่า หรือไม่ถ้าลูกค้ายังอยากที่จะใช้บัตรอยู่เนี่ย ลูกค้าก็จ่ายขั้นต่ำก็ได้ อยู่ที่หนึ่งพันเจ็ดร้อยสามสิบเจ็ดบาท,166.35,174.7,\\192.168.1.70\Data1\Logger\ACU\AEON_COLLECTION\20170300_COLHY_P2/0302_14/73065_b1c684bd4141613-10101001488438331-0.wav
จ่ายขั้นต่ำเข้ามาก่อนก็ได้ค่ะ หนึ่งพันสามร้อยสามสิบ,45.25,48.1,\\192.168.1.70\Data1\Logger\ACU\AEON_COLLECTION\20170300_COLHY_P2/0304_13/73037_a69016c2a4ca414-10101001488608974-0.wav
ค่ะที่นี้ถ้าเกิดว่าเดือนเนี่ย เดือน เดือนมีนา ถ้าลูกค้าจ่ายขั้นต่ำเข้ามาปกติ บัตรของคุณก็ใช้ได้ปกติคะ,221.55,227.82,\\192.168.1.70\Data1\Logger\ACU\AEON_COLLECTION\20170300_COLHY_P2/0303_15/73316_c18b43f9b4eb69d-10101001488528205-0.wav
แต่มันบัตรเนี่ย เราจ่ายขั้นต่ำมาก่อน สี่ร้อยเก้าสิบสี่บาท ถ้าเกิดว่า,139.81,143.38,\\192.168.1.70\Data1\Logger\ACU\AEON_COLLECTION\20170300_COLHY_P2/0302_13/73338_75bd59c27f7481d-10101001488434501-0.wav
ไม่แน่ลูกค้าจ่ายขั้นต่ำมาหกพันเสียหกพันสามร้อยยี่สิบกดคืนได้ห้าพัน ลูกค้าจะกดสักสองพันสามพันหรือสักพันแล้วแต่,135.77,142.24,\\192.168.1.70\Data1\Logger\ACU\AEON_COLLECTION\20170300_COLHY_P2/0302_13/73027_3696287c66379d3-10101001488434316-0.wav
ลูกค้าจ่ายขั้นต่ำหมุนบัตรกลับ จ่ายขั้นต่ำหมุนบัตรกลับแบบเนี้ยไปได้เรื่อยเรื่อย แต่วงเงินตรงเนี้ยขึ้นอยู่กับเราว่าเราจะกดหมดหรือไม่หมดแล้วแต่นะคะ,128.55,135.65,\\192.168.1.70\Data1\Logger\ACU\AEON_COLLECTION\20170300_COLHY_P2/0302_13/73027_3696287c66379d3-10101001488434316-0.wav
คือคือตรงเนี้ยมันจะจ่ายขั้นต่ำและหมุนบัตร ได้ตลอด ได้ทุกเดือนเลยค่ะ แต่ว่าขึ้นอยู่กับวงเงินที่ลูกค้าจะใช้อ่ะค่ะ แต่วงเงินของลูกค้าจะอยู่ประมาณเนี้ย,120.79,128.49,\\192.168.1.70\Data1\Logger\ACU\AEON_COLLECTION\20170300_COLHY_P2/0302_13/73027_3696287c66379d3-10101001488434316-0.wav
แต่ถ้าเกิดว่าลูกค้าไม่สามารถที่จะจ่ายขั้นต่ำได้ บริษัทก็มีทางออกให้อยู่ คือให้ลูกค้าเนี่ย,141.72,146.63,\\192.168.1.70\Data1\Logger\ACU\AEON_COLLECTION\20170300_COLHY_P2/0304_10/73106_ae9b2fe7957a747-10101001488599677-0.wav
ซึ่งเนี่ยผมอยากให้คุณ %name% เนี่ย หาทางออกให้บริษัทนิดนึง ซึ่งถ้าเกิดโอเค คุณ %name% ไม่สามารถที่จะจ่ายขั้นต่ำได้,110.3,116.34,\\192.168.1.70\Data1\Logger\ACU\AEON_COLLECTION\20170300_COLHY_P2/0304_10/73106_ae9b2fe7957a747-10101001488599677-0.wav
คือตอนเนี้ย คือถ้าเกิดว่ารอคุณ %name% อ่า จ่ายขั้นต่ำเนี่ย,57.7,62.15,\\192.168.1.70\Data1\Logger\ACU\AEON_COLLECTION\20170300_COLHY_P2/0304_10/73106_ae9b2fe7957a747-10101001488599677-0.wav
ไม่ใช่คือตอนเนี้ยลูกค้าจ่ายขั้นต่ำมาเปิดบัตรได้,84.71,87.91,\\192.168.1.70\Data1\Logger\ACU\AEON_COLLECTION\20170300_COLHY_P2/0304_10/73027_34dd76d26655312-10101001488599484-0.wav
ใช่ใช่ ก็ที่เหลือพันนึงก็จะเข้าใช่ เข้าในส่วนของเงินต้น ก็ลูกค้าถ้าจ่ายขั้นต่ำ ลูกค้าจะกดได้หนึ่งพันบาท เดือนไหนเรา,420.43,427.49,\\192.168.1.70\Data1\Logger\ACU\AEON_COLLECTION\20170300_COLHY_P2/0304_10/73410_c5167bba452cdcd-10101001488598258-0.wav
ถ้าจ่ายขั้นต่ำก็กดได้ หนึ่งพันบาทอ่ะค่ะ,377.45,380.64,\\192.168.1.70\Data1\Logger\ACU\AEON_COLLECTION\20170300_COLHY_P2/0304_10/73410_c5167bba452cdcd-10101001488598258-0.wav
บัตรวีซ่าน่ะ ลูกค้าจะชำระยอดเต็มจำนวนมั้ย หรือว่าจ่ายขั้นต่ำ,301.35,307.25,\\192.168.1.70\Data1\Logger\ACU\AEON_COLLECTION\20170300_COLHY_P2/0302_09/73316_54f350500d64c0e-10101001488421768-0.wav
หรือหรือจะเก็บเอาไว้ก่อนก็ได้ค่ะ แล้วก็ลูกค้าก็จ่ายขั้นต่ำอ่าค่างวดขั้นต่ำเดือนนี้ปรกติ,279.97,284.3,\\192.168.1.70\Data1\Logger\ACU\AEON_COLLECTION\20170300_COLHY_P2/0302_09/73314_024a4ea87889f47-10101001488423077-0.wav
มันก็ลูกค้าก็จ่ายขั้นต่ำมาอีก ลูกค้าไม่ได้จ่ายเต็มจำนวนน่ะฮ่ะ มันก็เลยทบไปเรื่อยเรื่อยนะฮะ,185.47,190.34,\\192.168.1.70\Data1\Logger\ACU\AEON_COLLECTION\20170300_COLHY_P2/0303_11/73314_b4a85d5606d1e3e-10101001488513832-0.wav
อ่าก็คือลูกค้าจ่ายขั้นต่ำไงคะ ก็คือจริงจริงอ่ะ ยอดเต็มจำนวนมันอยู่ที่สามพันสี่ แต่ลูกค้าจ่ายสอง สองพันเจ็ดอย่างเงี้ยเองอ่ะค่ะ,172.5,179.12,\\192.168.1.70\Data1\Logger\ACU\AEON_COLLECTION\20170300_COLHY_P2/0303_11/73314_b4a85d5606d1e3e-10101001488513832-0.wav
%(ฉะ)% ใช่ค่ะ มันคือสาม สามพันหกร้อยสามสิบบาทนะคะ ตรงนี้จ่ายขั้นต่ำมาก่อนน่ะค่ะ ในส่วนตรงนี้,142.14,148.69,\\192.168.1.70\Data1\Logger\ACU\AEON_COLLECTION\20170300_COLHY_P2/0303_17/73077_ca8f5a350e0fdb0-10101001488537800-0.wav
ตัวตัวไหนอ่ะคะ ตัว อ๋อ คือจะจ่ายขั้นต่ำนะ สี่ร้อยห้าสิบถูกมั้ย,174.82,179.52,\\192.168.1.70\Data1\Logger\ACU\AEON_COLLECTION\20170300_COLHY_P1/0301_17/73316_b9675e0e91badb0-10101001488363138-0.wav
อ่า นะ ถ้าเกิดตรงนี้เนี่ย ก็คือว่าอยากให้ลูกค้าจ่ายขั้นต่ำมาก่อนนะ ห้าร้อย เพราะมันจะมีผลต่อประวัติ %(ประ)% ประวัติ credit อะไรด้วยนะคะ,429.45,436.06,\\192.168.1.70\Data1\Logger\ACU\AEON_COLLECTION\20170300_COLHY_P1/0301_10/73336_fbf25c4a08677c0-10101001488337770-0.wav
แน่นอนค่ะ ลูกค้าจ่ายขั้นต่ำมีดอกเบี้ยอยู่แล้วค่ะ เดือนละ,158.23,161.22,\\192.168.1.70\Data1\Logger\ACU\AEON_COLLECTION\20170300_COLHY_P2/0302_15/73316_fb98bca96817eff-10101001488443748-0.wav
จ่ายขั้นต่ำใช่,489.65,491.62,\\192.168.1.70\Data1\Logger\ACU\AEON_COLLECTION\20170300_COLHY_P1/0301_16/73366_178b29db3ecb08a-10101001488359448-0.wav
ไปรูดซื้อแล้วคุณมาจ่ายขั้นต่ำอ่ะ มันมีดอกเบี้ยอยู่แล้ว,181.3,184.59,\\192.168.1.70\Data1\Logger\ACU\AEON_COLLECTION\20170300_COLHY_P2/0302_15/73316_fb98bca96817eff-10101001488443748-0.wav
คือขั้นต่ำในที่นี้หมายถึงว่า ถ้าลูกค้าจ่ายขั้นต่ำแน่นอน ก็คือดอกเบี้ยมันเกิดขึ้นอยู่แล้ว แต่,93.23,98.58,\\192.168.1.70\Data1\Logger\ACU\AEON_COLLECTION\20170300_COLHY_P1/0301_17/73316_b9675e0e91badb0-10101001488362460-0.wav
ซึ่งดอกเบี้ยตรงนี้คิดจากยอดเต็มจำนวนนะคะ ไม่ได้คิดจากยอดที่คุณมีการจ่ายขั้นต่ำเข้ามานะคะ,83.3,89.26,\\192.168.1.70\Data1\Logger\ACU\AEON_COLLECTION\20170300_COLHY_P1/0301_17/73316_b9675e0e91badb0-10101001488362460-0.wav
อ่าหลังจากนี้ลูกค้าก็ยื่นจ่ายขั้นต่ำเข้ามา แล้วลูกค้าก็ต้องรีบ โทรไปคุยรายละเอียด ถ้าลูกค้าต้องการจะยกเลิก,367.47,373.07,\\192.168.1.70\Data1\Logger\ACU\AEON_COLLECTION\20170300_COLHY_P1/0301_09/73340_0896a6c353975d3-10101001488336932-0.wav
ยื่นจ่ายขั้นต่ำเข้ามาเรียบร้อย จ้ะ,261.63,264.02,\\192.168.1.70\Data1\Logger\ACU\AEON_COLLECTION\20170300_COLHY_P1/0301_09/73340_0896a6c353975d3-10101001488336932-0.wav
ณ ตอนนี้คุณไปปิดเลยไม่มีดอกเบี้ย แต่ถ้าคุณจ่ายขั้นต่ำห้าร้อยเดือนหน้า ดอกเบี้ยเกิดขึ้น,124.8,129.15,\\192.168.1.70\Data1\Logger\ACU\AEON_COLLECTION\20170300_COLHY_P1/0301_15/73495_5449b13eafe5f79-10101001488358311-0.wav
ณ ตอนนี้ถ้าคุณจ่ายขั้นต่ำมาวันนี้คุณก็ใช้ได้ เพราะบัตรวงเงินของคุณยังมีค่ะ,222.57,226.74,\\192.168.1.70\Data1\Logger\ACU\AEON_COLLECTION\20170300_COLHY_P1/0301_14/73027_98908e0b6cebfdf-10101001488355012-0.wav
เพราะถ้าลูกค้าจ่ายขั้นต่ำ ลูกค้าต้องเคลียร์ยอดให้เรียบร้อย ก่อนวันที่หนึ่งแล้วลูกค้าสามารถใช้บัตรได้จนถึงวันที่สี่,95.61,100.98,\\192.168.1.70\Data1\Logger\ACU\AEON_COLLECTION\20170300_COLHY_P1/0301_14/73027_98908e0b6cebfdf-10101001488355012-0.wav
เพราะถ้าลูกค้าไปกด %(วันจะ)% ไปจ่ายวันเสาร์ ใช้บัตรไม่ได้แล้วค่ะ มันเลยเวลาที่จะจ่ายขั้นต่ำ และใช้บัตรแล้วนะคะ ลูกค้า,77.02,83.05,\\192.168.1.70\Data1\Logger\ACU\AEON_COLLECTION\20170300_COLHY_P1/0301_14/73027_98908e0b6cebfdf-10101001488355012-0.wav
%?% คือถ้าเกิด ถ้าลูก คุณลูกค้าจ่ายขั้นต่ำก็คือ ของรายการบัตรก็คือ สี่ร้อยบาทครับ แต่ถ้าเกิดว่าคุณลูกค้าต้องการยอดปิดก็,121.55,130.44,\\192.168.1.70\Data1\Logger\ACU\AEON_COLLECTION\20170300_COLHY_P1/0301_09/73364_38dc01935b7357e-10101001488336819-0.wav
ขั้นต่ำก็เป็นยอดที่จากยอดเต็มจำนวน ตามรอบของลูกค้าค่ะ มาเฉลี่ยจ่ายขั้นต่ำ เพราะว่าขั้นต่ำของบัตรต่อเดือนต้องไม่ต่ำกว่าห้าร้อยบาท,46.04,53.54,\\192.168.1.70\Data1\Logger\ACU\AEON_COLLECTION\20170300_COLHY_P1/0301_09/73312_5360b34904bea09-10101001488336493-0.wav
อ่าจะกดเงินเนี่ยดิฉันแนะนำให้คุณจ่ายขั้นต่ำภายในวันที่สองไม่เกินวันที่สี่เนี่ยทุกเดือนนะคะ,152.77,158.32,\\192.168.1.70\Data1\Logger\ACU\AEON_COLLECTION\20170300_COLHY_P1/0301_16/73495_0426841b56b8dae-10101001488360982-0.wav
ค่ะใช่ใช่ถ้าเกิดลูกค้าจ่ายขั้นต่ำอย่างเงี้ย ลูกค้าต้องทำประวัติไปสักระยะนึงถึงจะกดได้เพราะว่าวงเงินมันติดลบอยู่ %(ก้า)%,394.55,400.75,\\192.168.1.70\Data1\Logger\ACU\AEON_COLLECTION\20170300_COLHY_P1/0301_16/73495_0426841b56b8dae-10101001488360982-0.wav
คิดอย่างงี้แล้วกันเพราะว่า ต่อเดือนเนี่ยลูกค้าจ่ายขั้นต่ำห้าร้อยเก้าสิบเจ็ดใช่มั้ยคะ,363.85,368.12,\\192.168.1.70\Data1\Logger\ACU\AEON_COLLECTION\20170300_COLHY_P1/0301_16/73495_0426841b56b8dae-10101001488360982-0.wav
อ่าพอเราจ่ายขั้นต่ำปุ๊บเราไม่ได้บวกส่วนต่างเข้ามามันก็เลยกดเงินไม่ได้อ่าเหมือนเดือนนี้สักครู่นะคะ,110.55,117.13,\\192.168.1.70\Data1\Logger\ACU\AEON_COLLECTION\20170300_COLHY_P1/0301_16/73495_0426841b56b8dae-10101001488360982-0.wav
อันนี้คือคุณ %name% จะสะดวกเคลียร์เป็นปกติมั้ย หรือว่าจะจ่ายขั้นต่ำไปก่อน,98.05,102.52,\\192.168.1.70\Data1\Logger\ACU\AEON_COLLECTION\20170300_COLHY_P1/0301_15/73067_fdb65716c770a50-10101001488355883-0.wav
